id,best_version,times_written,variation_count,rating,sounds_like,maturity_rating,length_tag,subject_tags,style_tags,set_usage,all_variations
J1826,Apr 8 dab bros 80s horror movie theme Carolynn Xavier scream Mikah Wyman freddy Ben Sawyer puppet master DJ Buckley jaws Paula Kosienski chucky Apr 22 Western theme Caleb McCraw Forest Bopp Charter Aswad Nate Allen Joey Goodsong Camron Sheppard #shows #dabbros.,1,1,65,Patton Oswalt,PG-ish,medium,pop culture,personal,,Apr 8 dab bros 80s horror movie theme Carolynn Xavier scream Mikah Wyman freddy Ben Sawyer puppet master DJ Buckley jaws Paula Kosienski chucky Apr 22 Western theme Caleb McCraw Forest Bopp Charter Aswad Nate Allen Joey Goodsong Camron Sheppard #shows #dabbros.
J1827,"Nice shirt compliments in front of 4 other people wearing shirts Like If I went to this table and said to you in particular and said ""WOW you look lovely this evening."" (Glance at other people at table with a displeased expression.",1,1,65,Bill Burr,PG-ish,medium,dating/sex | technology,personal,,"Nice shirt compliments in front of 4 other people wearing shirts Like If I went to this table and said to you in particular and said ""WOW you look lovely this evening."" (Glance at other people at table with a displeased expression."
J1828,Osama bin ladin sending dudes to fly into banks is like if 9 rednecks bombed a mosque and Pakistan declared war on Tucker Carlson. They find him in a bunker in Canada playing PlayStation with Bill O'Reilly and Anne Coulter Emotionally deaf.,1,1,65,Mitch Hedberg,PG-ish,medium,misc/observational,observational,,Osama bin ladin sending dudes to fly into banks is like if 9 rednecks bombed a mosque and Pakistan declared war on Tucker Carlson. They find him in a bunker in Canada playing PlayStation with Bill O'Reilly and Anne Coulter Emotionally deaf.
J1829,"June Shows June 1 Kava Laughs & Dabs @ Cub of Kava, Clarksville, TN June 8 Threadbare Comedy @ The Annex at Third Coast June 13 Dive Hard @ The Dive Motel June 22-23 June Jam @ Flagstaff, AZ.",1,1,68,Mitch Hedberg,PG-ish,medium,dating/sex | drugs/sobriety,observational,,"June Shows June 1 Kava Laughs & Dabs @ Cub of Kava, Clarksville, TN June 8 Threadbare Comedy @ The Annex at Third Coast June 13 Dive Hard @ The Dive Motel June 22-23 June Jam @ Flagstaff, AZ."
J1830,"OnlyFans wage gap Sick of the wage gap. Anyone else? Women are making 78% ...more than men on Onlyfans. Most OnlyFans users are men, yet we only make 22 cents on the dollar, even though my feet pics are just as cute. Onlyfans.com/krisravesfeet.",4,4,75,Bill Burr,PG-ish,medium,misc/observational | dating/sex | work/money,personal | observational | relationship,,"OnlyFans wage gap Sick of the wage gap. Anyone else? Women are making 78% ...more than men on Onlyfans. Most OnlyFans users are men, yet we only make 22 cents on the dollar, even though my feet pics are just as cute. Onlyfans.com/krisravesfeet. | Confused Fox News host Sick of these Mexicans taking all our good American cages. Those cages were meant for hard working Americans and their families. If you're gonna live in a cage at least learn to speak American! Christ on a cracker! | Sick of double standards I know a guy who has a condition where he is 25 but looks 16 and no women will date him. Guys hit on him all the time. If he were a woman she'd be dripping in dicks. She'd prolly be dating Drake. But women don't want him. I think it's because men are physically motivated. We are attracted to what we see, and women are more attracted to money. | Sick."
J1831,Grippy girls This girl I'm trying to smash was in the psyche ward this weekend and I know I should just let it go...but I won't. I'm just saying The grippiest thing on that girl is Not her socks. Unmedicated? More like FUNmedicated.,1,1,75,Mitch Hedberg,PG-ish,medium,misc/observational,personal,,Grippy girls This girl I'm trying to smash was in the psyche ward this weekend and I know I should just let it go...but I won't. I'm just saying The grippiest thing on that girl is Not her socks. Unmedicated? More like FUNmedicated.
J1832,"Subconscious save Thought of a hilarious joke on the way here but it was kinda racist. I smoke a lot of pot so I forgot it immediately. Probably for the best. My subconscious gave me the, ""Hey man... Not cool..."" So funny lol.",1,1,75,Steven Wright,PG-ish,medium,drugs/sobriety,personal,,"Subconscious save Thought of a hilarious joke on the way here but it was kinda racist. I smoke a lot of pot so I forgot it immediately. Probably for the best. My subconscious gave me the, ""Hey man... Not cool..."" So funny lol."
J1833,"Worked at a Christmas themed dive bar called santas pub, because the owner looked like Santa Claus. While I was working Santa passed away. Based on the rules of the popular Tim Allen Christmas Classic: The Santa Clause... The new Santa is... mesothelioma.",1,1,75,Bill Burr,PG-13,medium,work/money,personal,,"Worked at a Christmas themed dive bar called santas pub, because the owner looked like Santa Claus. While I was working Santa passed away. Based on the rules of the popular Tim Allen Christmas Classic: The Santa Clause... The new Santa is... mesothelioma."
J1834,"The All American Retirees When we live such fragile lives We'll get covid, then we die I'll tell you my dirty little secret Dirty little secret Dirty little secret I popped my pants Don't tell any one or you'll be Just another regret.",1,1,75,Dave Attell,PG-ish,medium,misc/observational,personal,,"The All American Retirees When we live such fragile lives We'll get covid, then we die I'll tell you my dirty little secret Dirty little secret Dirty little secret I popped my pants Don't tell any one or you'll be Just another regret."
J1835,"Add music, sound effects, particle effects, magic effects, more elaborate levels with designated paths surrounded by map assets based on the map theme. Each hit should feel visceral. Add death animations. Make the player sprites more detailed in 32 bit pixel art style.",1,1,68,Anthony Jeselnik,PG-13,medium,true crime/dark | pop culture | technology,dark,,"Add music, sound effects, particle effects, magic effects, more elaborate levels with designated paths surrounded by map assets based on the map theme. Each hit should feel visceral. Add death animations. Make the player sprites more detailed in 32 bit pixel art style."
J1836,Praying Mentis Preying mantis relationship makes sense. Women have a natural instinct to have children and kill men. Men have the natural instinct to have sex and die. At least MY Dad did. My mom's not even religious (praying mantis hands act out).,2,2,65,Nikki Glaser,R / club material,medium,dating/sex | family | true crime/dark | religion/spiritual,dark | relationship | personal | observational,Smokes n Jokes 5 min,Praying Mentis Preying mantis relationship makes sense. Women have a natural instinct to have children and kill men. Men have the natural instinct to have sex and die. At least MY Dad did. My mom's not even religious (praying mantis hands act out). | Praying Mentis.
J1837,"Old pics I know that's an old picture cuz in your mirror selfie youre holding an iPhone Six! That came out in 2014! You're posting ten year old pics I'm gonna say I'm 6'6"" and you better not say nothing when we meet.",1,1,65,Norm Macdonald,PG-ish,medium,technology,personal,,"Old pics I know that's an old picture cuz in your mirror selfie youre holding an iPhone Six! That came out in 2014! You're posting ten year old pics I'm gonna say I'm 6'6"" and you better not say nothing when we meet."
J1838,Trap House Procedurally generated multiplayer trap game. Takes place in a drug den. Story leads player from trying drugs for the first time all the way to becoming the President of the United States. (Turns the White House house into a trap house.).,1,1,65,Steven Wright,R / club material,medium,drugs/sobriety,personal,,Trap House Procedurally generated multiplayer trap game. Takes place in a drug den. Story leads player from trying drugs for the first time all the way to becoming the President of the United States. (Turns the White House house into a trap house.).
J1839,"A girl made fun of my beer belly last night. And that really hurt. Because I don't drink. If we watered our gardens with alcohol nothing would grow. Even if it did, there would be a lot more carrots in jail for domestic assault.",1,1,75,Dave Attell,PG-13,medium,drugs/sobriety | technology,personal,,"A girl made fun of my beer belly last night. And that really hurt. Because I don't drink. If we watered our gardens with alcohol nothing would grow. Even if it did, there would be a lot more carrots in jail for domestic assault."
J1840,"Bed wetting. Someone told me that wetting the bed as a kid is a sign you'll grow up to be a serial killer but I never wet the bed until AFTER I strangled seven women who smelled like my grandma. Your move, scientists. #Jokes.",1,1,75,Bill Burr,R / club material,medium,family | true crime/dark,dark | personal,,"Bed wetting. Someone told me that wetting the bed as a kid is a sign you'll grow up to be a serial killer but I never wet the bed until AFTER I strangled seven women who smelled like my grandma. Your move, scientists. #Jokes."
J1841,"How's this for a double standard. I have a friend with gorgeous flowing locks of hair. Women always telling him ""I wish I had your hair"" but whenever I tell a woman I want her hair she calls the cops? Might be my tone...",1,1,75,Bill Burr,PG-ish,medium,technology,personal,,"How's this for a double standard. I have a friend with gorgeous flowing locks of hair. Women always telling him ""I wish I had your hair"" but whenever I tell a woman I want her hair she calls the cops? Might be my tone..."
J1842,"They did a study and every man they tested had microplastics in his nuts. My question is. Why is that the first place they looked? I haven't heard anything about microplastics in my heart, brain, or bones. But my balls are full of em.",1,1,75,Mitch Hedberg,PG-ish,medium,technology,personal,,"They did a study and every man they tested had microplastics in his nuts. My question is. Why is that the first place they looked? I haven't heard anything about microplastics in my heart, brain, or bones. But my balls are full of em."
J1843,Ever hold a cat and think man I could crush you if I wanted to. But I won't cuz I luuuuvvv yuuuuui Half the guys in here have thought about body slamming a baby. Not DOING IT but what would happen if you did.,1,1,72,Steven Wright,PG-ish,medium,body/medical | technology,personal,,Ever hold a cat and think man I could crush you if I wanted to. But I won't cuz I luuuuvvv yuuuuui Half the guys in here have thought about body slamming a baby. Not DOING IT but what would happen if you did.
J1844,Treat every stranger like they've got something you want because they do Buds and boobs topless dab bar with lurk alarm like lunk alarm from pf Dad convinced his Dr to give him morphine to help him sleep Dr Patel maybe you know him.,1,1,72,Norm Macdonald,PG-ish,medium,family,observational,,Treat every stranger like they've got something you want because they do Buds and boobs topless dab bar with lurk alarm like lunk alarm from pf Dad convinced his Dr to give him morphine to help him sleep Dr Patel maybe you know him.
J1845,"Reversed 90s sitcom couples. Seeing a lot of reversed 90s sitcom couples objectively good looking guys walking around with girls that look like a three-way baby from Kevin James, Homer Simpson, and Jim Belushi. Nines and dimes cutting their prices for nickels and sixes.",1,1,68,Mitch Hedberg,PG-ish,medium,misc/observational,observational,,"Reversed 90s sitcom couples. Seeing a lot of reversed 90s sitcom couples objectively good looking guys walking around with girls that look like a three-way baby from Kevin James, Homer Simpson, and Jim Belushi. Nines and dimes cutting their prices for nickels and sixes."
J1846,"Degenix Reverse eugenics where we send our least desirable breeders to enemy territories and pay them to mate with the it's most genetically inferior citizens, gradually weakening the population enough to create a rift between the degens and the ruling class sparking civil war.",1,1,68,Mitch Hedberg,PG-13,medium,misc/observational,personal,,"Degenix Reverse eugenics where we send our least desirable breeders to enemy territories and pay them to mate with the it's most genetically inferior citizens, gradually weakening the population enough to create a rift between the degens and the ruling class sparking civil war."
J1847,I shaved my pubes I shaved my beard cuz it looked like ratty old man pubes. Now it looks like a smooth babys nut sack. Studies have shown beards make men more attractive to women. So I shaved it off. Nobody likes hot comedians.,1,1,65,Bill Burr,PG-ish,medium,body/medical,personal,,I shaved my pubes I shaved my beard cuz it looked like ratty old man pubes. Now it looks like a smooth babys nut sack. Studies have shown beards make men more attractive to women. So I shaved it off. Nobody likes hot comedians.
J1848,Men things women people and relationships Men think more about things whereas women think more about people and relationships. Which seems backwards when you realize men usually have sex with people they're in a relationship with and women usually have sex with things. #sexjoke.,1,1,65,Nikki Glaser,R / club material,medium,dating/sex,relationship,,Men things women people and relationships Men think more about things whereas women think more about people and relationships. Which seems backwards when you realize men usually have sex with people they're in a relationship with and women usually have sex with things. #sexjoke.
J1849,Oligarchy controlled by a small group of corporate interests who pay the mass media to brainwash us into hating each other over arbitrary differences so we don't realize the real enemy of our prosperity is corporate crony capitalism and an unchecked military-industrial complex. Supposably...,1,1,65,Mitch Hedberg,PG-13,medium,dating/sex | technology,personal,,Oligarchy controlled by a small group of corporate interests who pay the mass media to brainwash us into hating each other over arbitrary differences so we don't realize the real enemy of our prosperity is corporate crony capitalism and an unchecked military-industrial complex. Supposably...
J1850,Have you ever been attracted to someone until they do something kinda gross? That's why you don't think you're pretty. Because you know what you did. Everytime you look at yourself all you see is shame. Because you did that thing. You know I'm right.,1,1,75,Steven Wright,PG-ish,medium,misc/observational,personal,,Have you ever been attracted to someone until they do something kinda gross? That's why you don't think you're pretty. Because you know what you did. Everytime you look at yourself all you see is shame. Because you did that thing. You know I'm right.
J1851,"Observations with potential Everybody likes a hot guy dating an ugly woman but nobody likes an ugly guy dating a hot woman. If you marry someone of equal attractiveness then nobody cares. But tell someone youre dating your sister, and they wanna know every detail.",1,1,75,Nikki Glaser,PG-ish,medium,dating/sex | drugs/sobriety | body/medical | technology,relationship,,"Observations with potential Everybody likes a hot guy dating an ugly woman but nobody likes an ugly guy dating a hot woman. If you marry someone of equal attractiveness then nobody cares. But tell someone youre dating your sister, and they wanna know every detail."
J1852,22 in girl years I'm 37 which feels old but I try to remind myself that I'm only 5 and half in dog years and 22 in girl years. Only slightly past my prime and I still have a while before my eggs dry up.,2,1,72,Norm Macdonald,PG-ish,medium,misc/observational,personal | observational,Mouthhole,22 in girl years I'm 37 which feels old but I try to remind myself that I'm only 5 and half in dog years and 22 in girl years. Only slightly past my prime and I still have a while before my eggs dry up.
J1853,I wanna go to church but I feel like I don't belong. I'm a recovering drug and exotic dancer addict. I found the solution. I started going to the church that sends people to strip clubs to recruit strippers. The sexiest pulpit you've ever seen.,1,1,72,Nikki Glaser,R / club material,medium,dating/sex | drugs/sobriety | religion/spiritual,relationship | personal,,I wanna go to church but I feel like I don't belong. I'm a recovering drug and exotic dancer addict. I found the solution. I started going to the church that sends people to strip clubs to recruit strippers. The sexiest pulpit you've ever seen.
J1854,Shirt is louder than the microphone Glasses but they made me look gay. Crazy how colors make people uncomfortable. Like I understand if you're a blood and you see a lot of blue🔵 that's an unsafe situation. cover your boner everytime you see a rainbow.,1,1,72,Steven Wright,PG-13,medium,technology,personal,,Shirt is louder than the microphone Glasses but they made me look gay. Crazy how colors make people uncomfortable. Like I understand if you're a blood and you see a lot of blue🔵 that's an unsafe situation. cover your boner everytime you see a rainbow.
J1855,The Catholic Church just canonized a saint. He is a 15 year old influencer who died of cancer. I don't understand it. They called him a God influencer because he convinced a bunch of kids to join the Catholic Church... Oh now it's making sense.,1,1,72,Norm Macdonald,PG-ish,medium,family | religion/spiritual | pop culture | technology,absurd | personal,,The Catholic Church just canonized a saint. He is a 15 year old influencer who died of cancer. I don't understand it. They called him a God influencer because he convinced a bunch of kids to join the Catholic Church... Oh now it's making sense.
J1856,Do you need your liver to live? Yeh I think so. Isn't that why they call it a live er I don't want kids and I want a partner who can challenge me intellectually. Looking for a lady with narrow hips and a high iq.,1,1,68,John Mulaney,PG-ish,medium,family,personal,,Do you need your liver to live? Yeh I think so. Isn't that why they call it a live er I don't want kids and I want a partner who can challenge me intellectually. Looking for a lady with narrow hips and a high iq.
J1857,"I've never done that 23andMe DNA test where they trace your family back, have you? Does it know if you're inbred? Like can it tell if your parents were cousins? Is there a special section for invest on the slip of paper they send you?",1,1,68,Maria Bamford,PG-ish,medium,family | work/money,personal,,"I've never done that 23andMe DNA test where they trace your family back, have you? Does it know if you're inbred? Like can it tell if your parents were cousins? Is there a special section for invest on the slip of paper they send you?"
J1858,"Roasts When you were born the doctor had to pull little pieces of corn out of your body, you piece of shit. Your mom gave you plan B as a baby. New birth control pill called plan Z. Turns your newborn into the walking dead.",1,1,68,Anthony Jeselnik,R / club material,medium,family | true crime/dark | body/medical,dark,,"Roasts When you were born the doctor had to pull little pieces of corn out of your body, you piece of shit. Your mom gave you plan B as a baby. New birth control pill called plan Z. Turns your newborn into the walking dead."
J1859,"Strip Club Bouncer. Worked every weekend protecting vulnerable women, who hated me for being born a man, from perverts and gang members who are drunk and high on whatever prescription drug sound cloud rappers get paid to sing about. All for minimum wage plus tits.",1,1,68,Bill Burr,R / club material,medium,drugs/sobriety | work/money | technology,personal,,"Strip Club Bouncer. Worked every weekend protecting vulnerable women, who hated me for being born a man, from perverts and gang members who are drunk and high on whatever prescription drug sound cloud rappers get paid to sing about. All for minimum wage plus tits."
J1860,Y'all'd've You know there's a word in English with two apostrophes in it? Y'all's. Is this ours or y'all's? Did you know there's one with three? Y'all'd've. I would have thought if I told y'all there's a word with three apostrophes then Y'all'd've been impressed.,1,1,68,Steven Wright,PG-ish,medium,misc/observational,personal,,Y'all'd've You know there's a word in English with two apostrophes in it? Y'all's. Is this ours or y'all's? Did you know there's one with three? Y'all'd've. I would have thought if I told y'all there's a word with three apostrophes then Y'all'd've been impressed.
J1861,There is an inverse relationship between how nice you are to children and how much money you make. Teachers... Very poor people. Very nice to children. Billionaires... Very rich people... Not nice to children. Michael Jackson : King of Pop Kevin Spacey: Oscar winning actor.,1,1,65,Steven Wright,PG-ish,medium,family | work/money | technology,observational,,There is an inverse relationship between how nice you are to children and how much money you make. Teachers... Very poor people. Very nice to children. Billionaires... Very rich people... Not nice to children. Michael Jackson : King of Pop Kevin Spacey: Oscar winning actor.
J1862,Interdimensional aliens who can see beyond time select certain exemplary children and alter their DNA to give them heightened specific senses so that when the time comes they will be the pivotal person to accomplish a task that keeps the universe from ending. Autistic superhumans.,1,1,65,Steven Wright,PG-ish,medium,dating/sex | family | technology,absurd | personal,,Interdimensional aliens who can see beyond time select certain exemplary children and alter their DNA to give them heightened specific senses so that when the time comes they will be the pivotal person to accomplish a task that keeps the universe from ending. Autistic superhumans.
J1863,Listening to emo music after 5 years of therapy Seems counter productive to do an hour of reprocessing childhood trauma then drive home blasting death cab for cutie. Favorite death cab album was called plans and my therapist asks me if I have a plan.,1,1,65,Anthony Jeselnik,PG-ish,medium,true crime/dark | pop culture | body/medical,dark | personal,,Listening to emo music after 5 years of therapy Seems counter productive to do an hour of reprocessing childhood trauma then drive home blasting death cab for cutie. Favorite death cab album was called plans and my therapist asks me if I have a plan.
J1864,She drank poison every day One sip at a time To calm her nerves The rest she craved. She felt fine inside Better than she deserved The poison kept her sane Outside Hell She sipped The ultimate sip and said Life is short Die slowly.,1,1,65,Steven Wright,PG-13,medium,religion/spiritual | technology,observational,,She drank poison every day One sip at a time To calm her nerves The rest she craved. She felt fine inside Better than she deserved The poison kept her sane Outside Hell She sipped The ultimate sip and said Life is short Die slowly.
J1865,"We had two poles at the strip club which was convenient because most of the girls were bipolar Comics tight 5 loose two Backstreet broken Emo music joey was the cool one xxxx was the bad boy, I was the broken one.",1,1,75,Patton Oswalt,PG-ish,medium,pop culture,personal,,"We had two poles at the strip club which was convenient because most of the girls were bipolar Comics tight 5 loose two Backstreet broken Emo music joey was the cool one xxxx was the bad boy, I was the broken one."
J1866,"Gotta get rich I need to make a bunch of money because I want to have a lot of kids and child support ain't cheap. I'm not planning on loving and leaving, I just don't expect full custody when she leaves me. Look at the numbers!",1,1,60,John Mulaney,PG-ish,medium,dating/sex | family | work/money | technology,personal,,"Gotta get rich I need to make a bunch of money because I want to have a lot of kids and child support ain't cheap. I'm not planning on loving and leaving, I just don't expect full custody when she leaves me. Look at the numbers!"
J1867,"In comedy you're supposed to punch up but you're also supposed to be self-deprecating so, what, am I making fun of the man I should be. Way to go trying to improve yourself, dumbass. Oh are you trying to break bad habits and generational curses? Pussy.",1,1,60,Mitch Hedberg,R / club material,medium,misc/observational,personal,,"In comedy you're supposed to punch up but you're also supposed to be self-deprecating so, what, am I making fun of the man I should be. Way to go trying to improve yourself, dumbass. Oh are you trying to break bad habits and generational curses? Pussy."
J1868,"Opening techniques Question: -Does anyone know??? Surprising moment: -i don't mean to alarm anyone, but... Pause Story: -Make your talk a movie Big promise -Tell audience what they will gain from listening to you Visual action hook -wear a fun outfit or have a visual prop.",1,1,60,Patton Oswalt,PG-ish,medium,family | pop culture | technology,personal,,"Opening techniques Question: -Does anyone know??? Surprising moment: -i don't mean to alarm anyone, but... Pause Story: -Make your talk a movie Big promise -Tell audience what they will gain from listening to you Visual action hook -wear a fun outfit or have a visual prop."
J1869,Hate my face. I feel like everyone sees everything they don't like about themselves in my face. They must hate my face. Or they hate me cuz they ain't me. But I doubt that's the case. Cuz if they were me. They'd hate me even more.,1,1,57,Mitch Hedberg,PG-ish,medium,technology,personal,,Hate my face. I feel like everyone sees everything they don't like about themselves in my face. They must hate my face. Or they hate me cuz they ain't me. But I doubt that's the case. Cuz if they were me. They'd hate me even more.
