id,best_version,times_written,variation_count,rating,sounds_like,maturity_rating,length_tag,subject_tags,style_tags,set_usage,all_variations
J0664,Eddie went to the barber and said make me look like a dry ramen noodle brick. That's not dandruff it's MSG.,1,1,65,Bill Burr,PG-ish,short,technology,personal,,Eddie went to the barber and said make me look like a dry ramen noodle brick. That's not dandruff it's MSG.
J0665,Emo band name puns Taking baths Sunday (emo with bad hygiene) All out boy (emo nudist) Panic at the Bris tho (recently circumcised emo) Death Cab for Booty (emo pirate).,1,1,65,Anthony Jeselnik,R / club material,medium,true crime/dark | pop culture,dark | personal,,Emo band name puns Taking baths Sunday (emo with bad hygiene) All out boy (emo nudist) Panic at the Bris tho (recently circumcised emo) Death Cab for Booty (emo pirate).
J0666,Emotional cheating is so much worse than actually cheating. You broke two people's hearts and didn't even put out.,1,1,65,Mitch Hedberg,PG-ish,short,misc/observational,observational,,Emotional cheating is so much worse than actually cheating. You broke two people's hearts and didn't even put out.
J0667,Emotional dyslexia I laugh when I'm angry I cry when I'm horny Happiness disgusts me.,1,1,65,Mitch Hedberg,PG-ish,short,dating/sex | technology,personal,,Emotional dyslexia I laugh when I'm angry I cry when I'm horny Happiness disgusts me.
J0668,Euthanasia face Angel of death Kinda sweetness you'd want from a suicide specialist Kinda smile that puts you at peace when you leave this plane of existence.,1,1,65,Anthony Jeselnik,R / club material,medium,dating/sex | true crime/dark,dark,,Euthanasia face Angel of death Kinda sweetness you'd want from a suicide specialist Kinda smile that puts you at peace when you leave this plane of existence.
J0669,Every baby that would have been aborted is now another soldier fighting for our side in the revolution.,1,1,65,Norm Macdonald,PG-ish,short,misc/observational,observational,,Every baby that would have been aborted is now another soldier fighting for our side in the revolution.
J0670,Every handicap stall should be gender neutral. So regardless of sexual orientation or gender identity we can all do drugs with our friends.,1,1,65,Nikki Glaser,R / club material,short,dating/sex | drugs/sobriety,relationship,,Every handicap stall should be gender neutral. So regardless of sexual orientation or gender identity we can all do drugs with our friends.
J0671,Everyday is a music festival in Nashville when you're homeless.,1,1,65,Mitch Hedberg,PG-ish,short,pop culture,observational,,Everyday is a music festival in Nashville when you're homeless.
J0672,Everyone goes through the gallery and comments on.,1,1,65,Bill Burr,PG-ish,short,misc/observational,observational,,Everyone goes through the gallery and comments on.
J0673,Ex wife was a teacher I was IT Makes sense. Teachers love kids and the IT department is always on the lookout for people who love kids.,1,1,65,Bill Burr,PG-ish,medium,dating/sex | family,relationship | personal,,Ex wife was a teacher I was IT Makes sense. Teachers love kids and the IT department is always on the lookout for people who love kids.
J0674,Fat couple Y'all look like you met on the McDonald's app.,1,1,65,Mitch Hedberg,PG-ish,short,body/medical | technology,observational,,Fat couple Y'all look like you met on the McDonald's app.
J0675,Feel like a turd waiting to be scooped out of the gene pool.,1,1,65,Mitch Hedberg,PG-ish,short,technology,observational,,Feel like a turd waiting to be scooped out of the gene pool.
J0676,Fetlife Found him asleep reading the Bible and his phone lit up Thing about kinks is if someone's into your's you'll lower your standards.,1,1,65,Mitch Hedberg,PG-ish,medium,religion/spiritual | technology,observational,,Fetlife Found him asleep reading the Bible and his phone lit up Thing about kinks is if someone's into your's you'll lower your standards.
J0677,Five o'clock somewhere. Not how timezones work. If it's 738 in Nashville it's five o'clock nowhere.,1,1,65,Steven Wright,PG-ish,short,work/money,observational,,Five o'clock somewhere. Not how timezones work. If it's 738 in Nashville it's five o'clock nowhere.
J0678,Frosted tips make me look like Look like if Eminem sang pop punk.,1,1,65,Mitch Hedberg,PG-ish,short,misc/observational,personal,,Frosted tips make me look like Look like if Eminem sang pop punk.
J0679,Frozen sperm I Like the idea of there being a spawn of me after I die that I don't have to take care of or love.,1,1,65,Mitch Hedberg,PG-ish,medium,dating/sex,personal,,Frozen sperm I Like the idea of there being a spawn of me after I die that I don't have to take care of or love.
J0680,Funny on the spot topics Best/Worst Date Most embarrassing moment First job: movie gallery. 18 Manager Near death experience.,1,1,65,Anthony Jeselnik,PG-13,short,dating/sex | family | drugs/sobriety | true crime/dark | pop culture | work/money,dark,,Funny on the spot topics Best/Worst Date Most embarrassing moment First job: movie gallery. 18 Manager Near death experience.
J0681,Genie tails sounds like genitals And genie tails are technically a genie's genitals.,1,1,65,Mitch Hedberg,PG-ish,short,technology,observational,,Genie tails sounds like genitals And genie tails are technically a genie's genitals.
J0682,Get to know each other I'll ask you a question then tell you something about myself.,1,1,65,Mitch Hedberg,PG-ish,short,misc/observational,observational,Lakeside 9/20/2022,Get to know each other I'll ask you a question then tell you something about myself.
J0683,Getting black out drunk is like turning on vanish mode for real life.,1,1,65,Dave Attell,PG-13,short,drugs/sobriety,observational,,Getting black out drunk is like turning on vanish mode for real life.
J0684,Girl if you were ten years older I'd be paying you child support.,1,1,65,Norm Macdonald,PG-ish,short,misc/observational,observational,,Girl if you were ten years older I'd be paying you child support.
J0685,Give and take Taking too long to explain something with no payoff Silence.,1,1,65,Norm Macdonald,PG-ish,short,dating/sex | technology,observational,,Give and take Taking too long to explain something with no payoff Silence.
J0686,Give it up for Pressure for letting us do this.,1,1,65,Mitch Hedberg,PG-ish,short,misc/observational,observational,,Give it up for Pressure for letting us do this.
J0687,Giving 10 year olds steroids so their boobs don't grow.,1,1,65,Norm Macdonald,PG-ish,short,misc/observational,observational,,Giving 10 year olds steroids so their boobs don't grow.
J0688,Goal in life to make as much money as possible.,1,1,65,Mitch Hedberg,PG-ish,short,work/money,observational,,Goal in life to make as much money as possible.
J0689,Going to bars and pretending to pick up a drink for door dash.,1,1,65,Mitch Hedberg,PG-ish,short,misc/observational,observational,,Going to bars and pretending to pick up a drink for door dash.
J0690,Goldfish cracker I'm not a goldfish cracker kinda guy More of a silverfish honkey.,1,1,65,Norm Macdonald,PG-ish,short,misc/observational,observational,,Goldfish cracker I'm not a goldfish cracker kinda guy More of a silverfish honkey.
J0691,Good pussy is like good cocaine It's got fish scales.,1,1,65,Mitch Hedberg,R / club material,short,drugs/sobriety | technology,observational,,Good pussy is like good cocaine It's got fish scales.
J0692,Got arrested cuz I forgot to say jk at the end.,1,1,65,Mitch Hedberg,PG-ish,short,misc/observational,personal,,Got arrested cuz I forgot to say jk at the end.
J0693,Got high on Fairy Dust and climbed in the drive thru window at Wendy's.,1,1,65,Mitch Hedberg,PG-ish,short,technology,observational,,Got high on Fairy Dust and climbed in the drive thru window at Wendy's.
J0694,Got so high I forgot where my feet were.,1,1,65,Mitch Hedberg,PG-ish,short,misc/observational,personal,,Got so high I forgot where my feet were.
J0695,Gotta rub one out at least once every few years or you'll die. That's how people get strokes!,1,1,65,Mitch Hedberg,PG-ish,short,misc/observational,observational,,Gotta rub one out at least once every few years or you'll die. That's how people get strokes!
J0696,Grown up emo bands Step dad for cutie.,1,1,65,Norm Macdonald,PG-ish,short,family | pop culture,observational,,Grown up emo bands Step dad for cutie.
J0697,Guy who invented tentacle porn as a kid What happened to him to make him create tentacle porn.,1,1,65,John Mulaney,R / club material,short,dating/sex | family | technology,observational,,Guy who invented tentacle porn as a kid What happened to him to make him create tentacle porn.
J0698,Had to break up with my girlfriend cuz she's sexist and a lesbian.,1,1,65,Nikki Glaser,R / club material,short,dating/sex,relationship | personal,,Had to break up with my girlfriend cuz she's sexist and a lesbian.
J0699,Hair stylist had no eyebrows. Why would I want you to cut my hair when you look like you tried to cut your own and missed.,1,1,65,Mitch Hedberg,PG-ish,medium,technology,personal,,Hair stylist had no eyebrows. Why would I want you to cut my hair when you look like you tried to cut your own and missed.
J0700,Hairjob Handgig blowgig Cake pop anal beads gender reveal anal beads #Jokes.,1,1,65,Mitch Hedberg,PG-ish,short,work/money | technology,observational,,Hairjob Handgig blowgig Cake pop anal beads gender reveal anal beads #Jokes.
J0701,Halloween show cup of kava Josh Lewis Matt West Rhonda Sweat (remind her) Big Fripp (pending) David Freidlander Jo Collins.,1,1,65,Mitch Hedberg,PG-ish,short,drugs/sobriety,observational,,Halloween show cup of kava Josh Lewis Matt West Rhonda Sweat (remind her) Big Fripp (pending) David Freidlander Jo Collins.
J0702,Has had several near death experiences. One was. Thrown into the river unconscious.,1,1,65,Anthony Jeselnik,PG-ish,short,dating/sex | true crime/dark,dark,,Has had several near death experiences. One was. Thrown into the river unconscious.
J0703,Have IBS and like girls with big noses.,1,1,65,Mitch Hedberg,PG-ish,short,misc/observational,observational,Next set,Have IBS and like girls with big noses.
J0704,He wasn't at the last supper cuz you know the dealers always late.,1,1,65,Mitch Hedberg,PG-ish,short,misc/observational,observational,Dive Motel Birthday Show headlining set.,He wasn't at the last supper cuz you know the dealers always late.
J0705,Helen Keller learning piano Tried to teach her chopsticks and she had an asthma attack.,1,1,65,Mitch Hedberg,PG-ish,short,misc/observational,observational,,Helen Keller learning piano Tried to teach her chopsticks and she had an asthma attack.
J0706,Her mom taking Jack Skelington to court for more child support.,1,1,65,Maria Bamford,PG-ish,short,family,observational,,Her mom taking Jack Skelington to court for more child support.
J0707,Her name was Lex and she was a pro.,1,1,65,Mitch Hedberg,PG-ish,short,dating/sex,personal,,Her name was Lex and she was a pro.
J0708,Higher than the hair on an Angel's derriere.,1,1,65,Mitch Hedberg,PG-ish,short,technology,observational,,Higher than the hair on an Angel's derriere.
J0709,Highway billboard in Phoenix Legalize freedom God and country.,1,1,65,Mitch Hedberg,PG-ish,short,religion/spiritual,absurd,,Highway billboard in Phoenix Legalize freedom God and country.
J0710,Hot girls are with the hot guys and all the ugly girls are gay.,1,1,65,Nikki Glaser,PG-ish,short,misc/observational,observational,,Hot girls are with the hot guys and all the ugly girls are gay.
J0711,Hot showers My roommate takes showers so hot that when he gets out his skin is bright red. Which is crazy. Cuz he's black.,1,1,65,Nikki Glaser,PG-ish,medium,body/medical,personal,,Hot showers My roommate takes showers so hot that when he gets out his skin is bright red. Which is crazy. Cuz he's black.
J0712,Hyperbolic comparisons Shorter than the bathroom line at a swimming pool.,1,1,65,Mitch Hedberg,PG-ish,short,misc/observational,observational,,Hyperbolic comparisons Shorter than the bathroom line at a swimming pool.
J0713,I bet you have to forgive yourself a lot.,1,1,65,Mitch Hedberg,PG-ish,short,misc/observational,personal,,I bet you have to forgive yourself a lot.
J0714,I can do anything on my own except produce serotonin.,1,1,65,Mitch Hedberg,PG-ish,short,dating/sex,personal,,I can do anything on my own except produce serotonin.
J0715,I can see your cleavage in your neck.,1,1,65,Mitch Hedberg,PG-ish,short,misc/observational,personal,,I can see your cleavage in your neck.
J0716,I can't afford a girlfriend on my paycheck I can't afford $500 a month and girlfriends keep raising their rates. Girlfriend inflation is insane. They're more expensive and getting a lot fatter.,1,1,65,Nikki Glaser,PG-ish,medium,dating/sex | pop culture | body/medical | technology,relationship | personal,,I can't afford a girlfriend on my paycheck I can't afford $500 a month and girlfriends keep raising their rates. Girlfriend inflation is insane. They're more expensive and getting a lot fatter.
J0717,I can't remember the last time I dated someone without self harm scars.,1,1,65,Steven Wright,PG-ish,short,misc/observational,personal,,I can't remember the last time I dated someone without self harm scars.
J0718,I could be a ref in the wnba cuz I don't give a fuck if a woman's mad at me.,1,1,65,Mitch Hedberg,R / club material,short,misc/observational,personal,,I could be a ref in the wnba cuz I don't give a fuck if a woman's mad at me.
J0719,I could draw a diagram of the nerve endings in her body from memory.,1,1,65,Mitch Hedberg,PG-ish,short,body/medical,personal,,I could draw a diagram of the nerve endings in her body from memory.
J0720,I didn't like how other people's faces looked on my shirt so I made my own.,1,1,65,Mitch Hedberg,PG-ish,short,misc/observational,personal,,I didn't like how other people's faces looked on my shirt so I made my own.
J0721,I do comedy to inspire intelligence not satiate stupidity.,1,1,65,Mitch Hedberg,PG-ish,short,misc/observational,personal,,I do comedy to inspire intelligence not satiate stupidity.
J0722,I don't know how insane I am and nobody's been brave enough to tell me.,1,1,65,Mitch Hedberg,PG-ish,short,body/medical,personal,,I don't know how insane I am and nobody's been brave enough to tell me.
J0723,I don't understand why women like drag queens so much I thought y'all secretly hated girls who are prettier than you.,1,1,65,Bill Burr,PG-ish,short,misc/observational,personal,,I don't understand why women like drag queens so much I thought y'all secretly hated girls who are prettier than you.
J0724,I drove through Phoenix long story I agree Phoenix is sunny.,1,1,65,Norm Macdonald,PG-ish,short,misc/observational,personal,,I drove through Phoenix long story I agree Phoenix is sunny.
J0725,I farted during that photo so that picture is gonna stink.,1,1,65,Nikki Glaser,PG-ish,short,misc/observational,personal,,I farted during that photo so that picture is gonna stink.
J0726,I fell into a burning case of Chlamydia.,1,1,65,Mitch Hedberg,PG-ish,short,misc/observational,personal,,I fell into a burning case of Chlamydia.
J0727,I get why Christians want to convert people I saw God one time and ever since then I've been trying to get my friends to do DMT.,1,1,65,Steven Wright,PG-ish,medium,religion/spiritual,absurd | personal,,I get why Christians want to convert people I saw God one time and ever since then I've been trying to get my friends to do DMT.
J0728,I got a weird old Babyface now. Like a high school senior who started smoking in kindergarten Like Boss Baby before rehab.,1,1,65,Steven Wright,PG-ish,short,work/money,absurd | personal,,I got a weird old Babyface now. Like a high school senior who started smoking in kindergarten Like Boss Baby before rehab.
J0729,"I got fired from rolling Stone magazine for calling a philipino pop punk band ""Mid-Blink 182""",1,1,65,Mitch Hedberg,PG-ish,short,pop culture,personal,,"I got fired from rolling Stone magazine for calling a philipino pop punk band ""Mid-Blink 182"""
J0730,I got old eyelids. No one ever talks about how weird eyelids get as you age.,1,1,65,Mitch Hedberg,PG-ish,short,misc/observational,absurd | personal,,I got old eyelids. No one ever talks about how weird eyelids get as you age.
J0731,I grew up in a basic cable family Didn't have HBO until I was 18.,1,1,65,Maria Bamford,PG-ish,short,family,personal,,I grew up in a basic cable family Didn't have HBO until I was 18.
J0732,I hate going on dates So I don't.,1,1,65,Mitch Hedberg,PG-ish,short,misc/observational,personal,,I hate going on dates So I don't.
J0733,I know what causes autism Anime Japanimation Getting us back for that hir Oshima dibacle.,1,1,65,Mitch Hedberg,PG-ish,short,misc/observational,personal,,I know what causes autism Anime Japanimation Getting us back for that hir Oshima dibacle.
J0734,I like a girl who goes too far.,1,1,65,Mitch Hedberg,PG-ish,short,misc/observational,personal,,I like a girl who goes too far.
J0735,I like a lady with a checkered past Competitive gymnast Split the bar so many times you had to uppercut her charcuterie board to make her cum.,1,1,65,Steven Wright,R / club material,medium,misc/observational,personal,,I like a lady with a checkered past Competitive gymnast Split the bar so many times you had to uppercut her charcuterie board to make her cum.
J0736,I like it when I find out a girl I'm dating is racist. Cuz then I know she's an idiot. And stupid girls are freaky.,1,1,65,Nikki Glaser,PG-ish,medium,dating/sex,relationship | personal,,I like it when I find out a girl I'm dating is racist. Cuz then I know she's an idiot. And stupid girls are freaky.
J0737,I look like Chris Pratt sired a son with Jack Black.,1,1,65,Mitch Hedberg,PG-ish,short,misc/observational,personal,,I look like Chris Pratt sired a son with Jack Black.
J0738,I look like a hitler youth who grew up and joined antifa.,1,1,65,Mitch Hedberg,PG-ish,short,misc/observational,personal,,I look like a hitler youth who grew up and joined antifa.
J0739,I need a gyro I need a Mediterranean cheesesteak.,1,1,65,Mitch Hedberg,PG-ish,short,misc/observational,personal,,I need a gyro I need a Mediterranean cheesesteak.
J0740,"I put on a new roll of toilet paper and say ""You have no idea what's coming for you.""",1,1,65,Mitch Hedberg,PG-ish,short,misc/observational,personal,,"I put on a new roll of toilet paper and say ""You have no idea what's coming for you."""
J0741,I really hope I'm not responsible for my own death.,1,1,65,Anthony Jeselnik,PG-ish,short,true crime/dark,dark | personal,,I really hope I'm not responsible for my own death.
J0742,I stare at assholes When they cut me off in traffic Pull up next to them and stare straight into their anus.,1,1,65,Mitch Hedberg,PG-13,short,dating/sex | technology,personal,,I stare at assholes When they cut me off in traffic Pull up next to them and stare straight into their anus.
J0743,I take a dick pick a day to measure my progress.,1,1,65,Mitch Hedberg,R / club material,short,misc/observational,personal,,I take a dick pick a day to measure my progress.
J0744,I think it's disgusting how racists are treated in America. Dude says the N word you want to kill him or at least financially cripple him and his family. Be above it.,1,1,65,Anthony Jeselnik,R / club material,medium,family | true crime/dark,dark | personal,,I think it's disgusting how racists are treated in America. Dude says the N word you want to kill him or at least financially cripple him and his family. Be above it.
J0745,I try not to talk to much when a girl is flirting with me cu she already thinks I'm cute I don't want her to know I'm stupid.,1,1,65,Mitch Hedberg,PG-ish,medium,misc/observational,personal,,I try not to talk to much when a girl is flirting with me cu she already thinks I'm cute I don't want her to know I'm stupid.
J0746,I used to love those little Jell-O chocolate cups. Not anymore. I'm off-putting (rough).,1,1,65,Mitch Hedberg,PG-ish,short,dating/sex,personal,,I used to love those little Jell-O chocolate cups. Not anymore. I'm off-putting (rough).
J0747,I wanna be a dad. Trying to convince my side chick to go off birth control.,1,1,65,Norm Macdonald,PG-ish,short,family,personal,Stoned Cold Sober set,I wanna be a dad. Trying to convince my side chick to go off birth control.
J0748,I was named after the actor who played Superman in the 1980s. So everyone called me Superman in school. Could have been Jeffrey Dahmer. John Wayne probably gaycy. Bisexual buffalo bill.,1,1,65,Nikki Glaser,R / club material,medium,dating/sex | pop culture,relationship | personal,Lakeside 9/20/2022,I was named after the actor who played Superman in the 1980s. So everyone called me Superman in school. Could have been Jeffrey Dahmer. John Wayne probably gaycy. Bisexual buffalo bill.
J0749,I was on the stoned team last time.,1,1,65,Steven Wright,PG-ish,short,drugs/sobriety,personal,Stoned Cold Sober set,I was on the stoned team last time.
J0750,I was thinking of different ways we could implement agents. EBay Cryptocurrency arbitrage Etsy Fivrr.,1,1,65,Bill Burr,PG-ish,short,work/money,personal,,I was thinking of different ways we could implement agents. EBay Cryptocurrency arbitrage Etsy Fivrr.
J0751,I'd rather get back with my ex than do cocaine again. At least with her I could get a hard on ... Most of the time ... Sometimes.,1,1,65,Steven Wright,R / club material,medium,dating/sex | drugs/sobriety | technology,personal,,I'd rather get back with my ex than do cocaine again. At least with her I could get a hard on ... Most of the time ... Sometimes.
J0752,I'm a great dad Still financially support my children even though I'm not allowed to see them. That's what happens when you put abortions on a credit card.,1,1,65,Norm Macdonald,PG-ish,medium,family | technology,personal,,I'm a great dad Still financially support my children even though I'm not allowed to see them. That's what happens when you put abortions on a credit card.
J0753,I'm a natural bedhead The carpets match the drapes.,1,1,65,Mitch Hedberg,PG-ish,short,misc/observational,observational,,I'm a natural bedhead The carpets match the drapes.
J0754,I'm a step dad I'm raising THREE other guys kids My feet are pretty twinky.,1,1,65,Norm Macdonald,PG-ish,short,family | technology,personal,,I'm a step dad I'm raising THREE other guys kids My feet are pretty twinky.
J0755,I'm a straight shooter and I aim for the brain.,1,1,65,Mitch Hedberg,PG-ish,short,technology,personal,,I'm a straight shooter and I aim for the brain.
J0756,I'm different from most comics. My dad loved me.,1,1,65,Patton Oswalt,PG-ish,short,dating/sex | family | work/money,personal,,I'm different from most comics. My dad loved me.
J0757,I'm dumber than a cowboy on a donkey.,1,1,65,Mitch Hedberg,PG-ish,short,misc/observational,observational,,I'm dumber than a cowboy on a donkey.
J0758,I'm litter than a Christmas tree on chanukah.,1,1,65,Mitch Hedberg,PG-ish,short,misc/observational,observational,,I'm litter than a Christmas tree on chanukah.
J0759,I'm looking for a wife so if you know any married women willing to cheat let me know.,1,1,65,Bill Burr,PG-ish,short,dating/sex | family,relationship | personal,,I'm looking for a wife so if you know any married women willing to cheat let me know.
J0760,I'm pretty high maintenance in relationships. By that I mean you have to be pretty high to think I can maintain a relationship.,1,1,65,Mitch Hedberg,PG-ish,short,technology,personal,,I'm pretty high maintenance in relationships. By that I mean you have to be pretty high to think I can maintain a relationship.
J0761,I'm terrible at dating. Hour of play than a month of conversations.,1,1,65,Nikki Glaser,PG-ish,short,dating/sex,relationship,,I'm terrible at dating. Hour of play than a month of conversations.
J0762,I'm the baddest If I was a fish I'd skip school.,1,1,65,John Mulaney,PG-ish,short,misc/observational,personal,,I'm the baddest If I was a fish I'd skip school.
J0763,I'm thinking about turning Mormon. I could lie to God. Those girls are gorgeous. In Utah wives are buy two get one free. Intelligence without diligence is dangerous.,1,1,65,Bill Burr,PG-ish,medium,religion/spiritual,absurd | personal,,I'm thinking about turning Mormon. I could lie to God. Those girls are gorgeous. In Utah wives are buy two get one free. Intelligence without diligence is dangerous.
J0764,I've always looked a lot younger than I really am. In my ultrasound picture I was a sperm.,1,1,65,Mitch Hedberg,PG-ish,short,misc/observational,personal,,I've always looked a lot younger than I really am. In my ultrasound picture I was a sperm.
J0765,I've noticed that when women get in groups they tend to give the most compliments to the ugliest one.,1,1,65,Bill Burr,PG-ish,short,misc/observational,observational,,I've noticed that when women get in groups they tend to give the most compliments to the ugliest one.
J0766,Id like to see her sit on a subwoofer Make that booty do the truffle shuffle.,1,1,65,Mitch Hedberg,PG-ish,short,misc/observational,observational,,Id like to see her sit on a subwoofer Make that booty do the truffle shuffle.
J0767,Idiots can be successful I know people who run billion dollar industries that think the world is 6000 years old.,1,1,65,Norm Macdonald,PG-ish,short,misc/observational,personal,,Idiots can be successful I know people who run billion dollar industries that think the world is 6000 years old.
J0768,If Christopher Reeve was in the Epstein files I would be screwed. Be like if my dad named me Diddy for a joke.,1,1,65,Norm Macdonald,PG-ish,short,family,personal,,If Christopher Reeve was in the Epstein files I would be screwed. Be like if my dad named me Diddy for a joke.
