id,best_version,times_written,variation_count,rating,sounds_like,maturity_rating,length_tag,subject_tags,style_tags,set_usage,all_variations
J2127,Free Free is tricky word. And not just for people with speech impediments. What is free? Are we free? Is water free? Is this open mic free? You have to pay attention. Stand up open mics are a terrible investment. You're doing us a favor. Basically paying out of pocket to listen to strangers say things that would make God sick. We really need to regulate how things get advertised for free. This heart surgery will extend your life 10 years but order in the next 10 minutes and we'll throw in five more years absolutely free.,1,1,60,Bill Burr,PG-ish,long/story bit,dating/sex | religion/spiritual,absurd,,Free Free is tricky word. And not just for people with speech impediments. What is free? Are we free? Is water free? Is this open mic free? You have to pay attention. Stand up open mics are a terrible investment. You're doing us a favor. Basically paying out of pocket to listen to strangers say things that would make God sick. We really need to regulate how things get advertised for free. This heart surgery will extend your life 10 years but order in the next 10 minutes and we'll throw in five more years absolutely free.
J2128,"Other countries are saying things like, ""The Pharmaceutical Industry in America is pushing hormone blockers on children and jacking up the price because they know parents will pay anything to get their kid to stop cutting themself."" But this is AMERICA. in AMERICA big Pharma goes under God and country, sorry kids. Take your pills! Family comes fourth. Big Pharma calms my nerves when my brain begins to stir. Big Pharma brings light to the darkness by making my pupils the size of pinholes. Big Pharma asks for nothing in return. Most of your prescriptions are covered by Medicare Big Pharmaaaaaaaaaaaaaaaaaaaaaaaaaaaaaaaaaamen.",2,2,68,Dave Attell,PG-ish,long/story bit,work/money | technology,personal,,"Other countries are saying things like, ""The Pharmaceutical Industry in America is pushing hormone blockers on children and jacking up the price because they know parents will pay anything to get their kid to stop cutting themself."" But this is AMERICA. in AMERICA big Pharma goes under God and country, sorry kids. Take your pills! Family comes fourth. Big Pharma calms my nerves when my brain begins to stir. Big Pharma brings light to the darkness by making my pupils the size of pinholes. Big Pharma asks for nothing in return. Most of your prescriptions are covered by Medicare Big Pharmaaaaaaaaaaaaaaaaaaaaaaaaaaaaaaaaaamen. | People are mad People are getting offended over jokes because they are mad when they hear the joke. If you're mad, don't watch comedy. Go work out or hit something. When you're sad watch comedy. If you're traumatized see a therapist and ask them why you can't take a joke. We can put safe boring comedy on the internet or basic cable, but some people like the dirty stuff. Recording with your phone at a comedy show is like recording at a strip club. Only the most disgusting disrespectful people would post it online without your consent to get that dopamine kick when get that notifications number to 999. Make thoses Ks and Ms. Some people can't come until you like their last post. Like, like, heart ,heart, heart, saaaaaaaaaaaaaaaaaaaaaaavvvvveeeeed to favorites."
J2129,"Class notes AJ Martha Stewart lube (Imagine that episode of Martha Stewart living) It's, a lube thing No thank you no thank you Variance Zodiac kids premise very original Shicard Richardson Jenny: Good energy very confident Metro school Teacher of 15 years Applaud me like they applaud veterans at football games George Washington Carver invented peanut butter to cull weak white children Heather Good pace, good stage presence More Highs and lows Why she looks that way. What was she doing when she died. Destination funeral Turn your funeral into a fun eral Jim: Buckminster fuller? Wholesome stage presence Great voice.",1,1,60,John Mulaney,PG-13,long/story bit,family | work/money | technology,personal,,"Class notes AJ Martha Stewart lube (Imagine that episode of Martha Stewart living) It's, a lube thing No thank you no thank you Variance Zodiac kids premise very original Shicard Richardson Jenny: Good energy very confident Metro school Teacher of 15 years Applaud me like they applaud veterans at football games George Washington Carver invented peanut butter to cull weak white children Heather Good pace, good stage presence More Highs and lows Why she looks that way. What was she doing when she died. Destination funeral Turn your funeral into a fun eral Jim: Buckminster fuller? Wholesome stage presence Great voice."
J2130,"Google Maps Follower Maybe I'm just paranoid but is Big Brother getting bigger and brothereyer? Got a notification sound I've never heard before, so I'm already spooked like what the hell was that? said you have a new follower on Google maps! (Looks around real quick paranoid) looked back and saw a cute little puppy. I said (smiling) are you my new follower lil guy. Went to pet him and he bit me! So I slapped that puppy, stole his iphone and ran away. Dogs don't need iphones especially if they're gonna use them to stalk and bite stand up comics.#Jokes.",1,1,60,Patton Oswalt,PG-13,long/story bit,religion/spiritual | technology,personal,,"Google Maps Follower Maybe I'm just paranoid but is Big Brother getting bigger and brothereyer? Got a notification sound I've never heard before, so I'm already spooked like what the hell was that? said you have a new follower on Google maps! (Looks around real quick paranoid) looked back and saw a cute little puppy. I said (smiling) are you my new follower lil guy. Went to pet him and he bit me! So I slapped that puppy, stole his iphone and ran away. Dogs don't need iphones especially if they're gonna use them to stalk and bite stand up comics.#Jokes."
J2131,"Taymone Swiles Taylor Swift won the super bowl 2024. Rumor has it she's planning on dumping Travis Kelce for U.S. Olympic Gymnast Simone Biles. Taylor Swift has never won an Olympic gold medal, but her fans want her to have one, so it is spoken, so it shall be done. Sorry Travis Kelce. Guess you'll just have to settle for one of the billion other women trying to bang you right now. The swifties hold the key to winning world war 3. China, if you don't stop messing with Taiwan we are going to cancel all her concerts in Hong Kong.",1,1,60,Bill Burr,PG-ish,long/story bit,technology,observational,,"Taymone Swiles Taylor Swift won the super bowl 2024. Rumor has it she's planning on dumping Travis Kelce for U.S. Olympic Gymnast Simone Biles. Taylor Swift has never won an Olympic gold medal, but her fans want her to have one, so it is spoken, so it shall be done. Sorry Travis Kelce. Guess you'll just have to settle for one of the billion other women trying to bang you right now. The swifties hold the key to winning world war 3. China, if you don't stop messing with Taiwan we are going to cancel all her concerts in Hong Kong."
J2132,"13 year olds run social media and in turn society Man vs. bear. Good luck creating a healthy home-life for your children with a bear. And if that doesn't work out, do you really think the king of the forest would be any good at co-parenting? The man or bear thing bugged me at first. But then I remembered other things girls are afraid of. Like BUGS. Alone in the woods, Man or Cicadas Which would you pick? If you ran into a wolf or a wife in the woods? Keep in mind a wolf isn't legally entitled to half your stuff.",1,1,60,Bill Burr,PG-ish,long/story bit,dating/sex | family | work/money | body/medical | technology,relationship | personal,,"13 year olds run social media and in turn society Man vs. bear. Good luck creating a healthy home-life for your children with a bear. And if that doesn't work out, do you really think the king of the forest would be any good at co-parenting? The man or bear thing bugged me at first. But then I remembered other things girls are afraid of. Like BUGS. Alone in the woods, Man or Cicadas Which would you pick? If you ran into a wolf or a wife in the woods? Keep in mind a wolf isn't legally entitled to half your stuff."
J2133,"Relationship after relationship that should have never even started. Seeking a partner and failing to find one a soul crushing amount of times. Finally decided to forget about wanting someone else and just focusing on doing the things I love to do and hoping someone comes along who loves the same things I do and maybe even me, too. Which is what I wish I would have been doing my whole life. But if any single ladies in here wanna hurt a man trying to heal, hit me up after this. Especially creepy chicks Spooky bitches Edgar Allen Hoes in high school.",1,1,60,Steven Wright,PG-ish,long/story bit,dating/sex | religion/spiritual | technology,personal,,"Relationship after relationship that should have never even started. Seeking a partner and failing to find one a soul crushing amount of times. Finally decided to forget about wanting someone else and just focusing on doing the things I love to do and hoping someone comes along who loves the same things I do and maybe even me, too. Which is what I wish I would have been doing my whole life. But if any single ladies in here wanna hurt a man trying to heal, hit me up after this. Especially creepy chicks Spooky bitches Edgar Allen Hoes in high school."
J2134,"If I like a girl and I want to know if she likes me back. What I'll do is I will find a girl that's wayyyyyy prettier than the girl I like and ask her on a date. She says yes, right, so here's the trick. I take the gorgeous woman, who I don't give a shit about, somewhere I know my crush will be. If I see her shoot dirty looks at the hot girl, who, I repeat, means NOTHING to me. It wouldn't work if I was into her. She would never have agreed to the date if I was.",1,1,53,Nikki Glaser,PG-13,long/story bit,work/money,personal,,"If I like a girl and I want to know if she likes me back. What I'll do is I will find a girl that's wayyyyyy prettier than the girl I like and ask her on a date. She says yes, right, so here's the trick. I take the gorgeous woman, who I don't give a shit about, somewhere I know my crush will be. If I see her shoot dirty looks at the hot girl, who, I repeat, means NOTHING to me. It wouldn't work if I was into her. She would never have agreed to the date if I was."
J2135,"Could replace Shane Gillis with anyone I was staring at this guy the other day because he looked just like Shane Gillis then felt like an asshole because he saw me staring at him and thought it was because he was a little person. Like if Shane Gillis deconstructed into five tiny Shane Gillises this would be one of them. Or like have you ever played with those Russian nesting dolls? Like Matroyshka Shane Gillis. If you opened up Shane Gillis to find a slightly smaller and uglier Shane, then opened that Shane Gillis, this would be the Shane Gillis that I saw.",1,1,60,Steven Wright,PG-13,long/story bit,misc/observational,personal,,"Could replace Shane Gillis with anyone I was staring at this guy the other day because he looked just like Shane Gillis then felt like an asshole because he saw me staring at him and thought it was because he was a little person. Like if Shane Gillis deconstructed into five tiny Shane Gillises this would be one of them. Or like have you ever played with those Russian nesting dolls? Like Matroyshka Shane Gillis. If you opened up Shane Gillis to find a slightly smaller and uglier Shane, then opened that Shane Gillis, this would be the Shane Gillis that I saw."
J2136,Tim Burton Zaddy Why do toxic women love tim Burton? Try going to a strip club without seeing a tattoo of Jack skellington. Saddest things I ever saw on a stripper was a tattoo of Beetlejuice signing a child support check. Said her favorite movie was the nightmare before the Christmas her parents broke up. This is Halloween who gets custody... Poor girl... Halloween Halloween every other Halloween. God I loved her. We attract what we are and im traumatized! If Edward Scissorhands was a lesbian her name would be Edward Scissor-hands-tongues-and-toys. But he is straight so his name should be Edward Call-an-ambulance-I-cut-my-dick.,1,1,60,Dave Attell,R / club material,long/story bit,dating/sex | family | religion/spiritual | pop culture | work/money | technology,absurd | personal,,Tim Burton Zaddy Why do toxic women love tim Burton? Try going to a strip club without seeing a tattoo of Jack skellington. Saddest things I ever saw on a stripper was a tattoo of Beetlejuice signing a child support check. Said her favorite movie was the nightmare before the Christmas her parents broke up. This is Halloween who gets custody... Poor girl... Halloween Halloween every other Halloween. God I loved her. We attract what we are and im traumatized! If Edward Scissorhands was a lesbian her name would be Edward Scissor-hands-tongues-and-toys. But he is straight so his name should be Edward Call-an-ambulance-I-cut-my-dick.
J2137,Bowery June 21 Grown up emo kid My chemical midlife crisis Hair starting to fall out boy Aching back Sunday Panic at the Costco Checks not tragedies Too many want more? Jimmy eat world too close to bed. Circa survivors? Some of us didn't make it Backstreet boy creative differences I wanted it this way! Blow through a straw I'm gonna get her back tho Screamachu Pokemon please stay Peter pan syndrome Creepy Aladdin Diamond in the rough For profit prison inmate one Children in the congo mining metals for iphones wouldn't fit on the Lego box. All intensive purposes Supposably. Too percific.,1,1,53,John Mulaney,PG-ish,long/story bit,family | pop culture | technology,personal,,Bowery June 21 Grown up emo kid My chemical midlife crisis Hair starting to fall out boy Aching back Sunday Panic at the Costco Checks not tragedies Too many want more? Jimmy eat world too close to bed. Circa survivors? Some of us didn't make it Backstreet boy creative differences I wanted it this way! Blow through a straw I'm gonna get her back tho Screamachu Pokemon please stay Peter pan syndrome Creepy Aladdin Diamond in the rough For profit prison inmate one Children in the congo mining metals for iphones wouldn't fit on the Lego box. All intensive purposes Supposably. Too percific.
J2138,"Crippling Superman complex 38 year old straight man who looks like a 29 year old lesbian. Tiger King opened a Dispensary Backstreet boy that got kicked out for creative differences. I wanted it This way! Value vet, budget pediatrics, Tom and Tony's discount OBGYN. On the sign Tony's name is crossed out cuz him and Tom had a falling out and Tom is cheap and petty. Super Jeffrey Dahmer Supergirl Reverse xray vision Swallowed whole Blow through a straw Screamachu Pokemon please stay I'm good I've had sex several times since then. Peter pan syndrome Jeffrey Epstein Peter pan Creepy Aladdin Slave One.",1,1,53,Nikki Glaser,R / club material,long/story bit,dating/sex | pop culture | technology,relationship | personal,,"Crippling Superman complex 38 year old straight man who looks like a 29 year old lesbian. Tiger King opened a Dispensary Backstreet boy that got kicked out for creative differences. I wanted it This way! Value vet, budget pediatrics, Tom and Tony's discount OBGYN. On the sign Tony's name is crossed out cuz him and Tom had a falling out and Tom is cheap and petty. Super Jeffrey Dahmer Supergirl Reverse xray vision Swallowed whole Blow through a straw Screamachu Pokemon please stay I'm good I've had sex several times since then. Peter pan syndrome Jeffrey Epstein Peter pan Creepy Aladdin Slave One."
J2139,"Temporal Jokes I don't have any felonies, yet I'm a single Father. Well, I was... Until I got remarried! I'm no longer single and I gave up custody cuz my new wife hates kids. The last time I did a Jedi Mind Flip was six no seven years from now. 2031. My buddy past me the pipe and I remember hitting it then the sofa ai was sitting on flipped backwards and the whole room inverted and all of a sudden it was 2020 and I was in a cave in China sneezing on a bat, but it's cool I just got my COVID booster.",1,1,60,Nikki Glaser,PG-ish,long/story bit,dating/sex | family | body/medical | technology,relationship | personal,,"Temporal Jokes I don't have any felonies, yet I'm a single Father. Well, I was... Until I got remarried! I'm no longer single and I gave up custody cuz my new wife hates kids. The last time I did a Jedi Mind Flip was six no seven years from now. 2031. My buddy past me the pipe and I remember hitting it then the sofa ai was sitting on flipped backwards and the whole room inverted and all of a sudden it was 2020 and I was in a cave in China sneezing on a bat, but it's cool I just got my COVID booster."
J2140,"Butlers easy Phoenix AZ Tiger king comedy Leslie Miley Cyrus in that leaked video where she smoked salvia Mary Barista blow Escobar 8:13 This way, Backstreet Seattle sober Grown up emo kid Panic at the Costco Hair starting to fallout boy Sugar it hurts when I'm leaning My chemical reverse mortgage Draw from bucket Spermologist Love goth girls Spooky bitches? Love some Edgar Allen Hoes Fired from hot topic scaring customers Tattoo on her thigh of Jack skelington signing a child support check Nightmare before the Christmas that her parents got divorced This is Halloween who gets custody Every other Halloween Astrojizzicist All intensive purposes.",1,1,60,John Mulaney,PG-ish,long/story bit,dating/sex | family | drugs/sobriety | pop culture | work/money | technology,personal,,"Butlers easy Phoenix AZ Tiger king comedy Leslie Miley Cyrus in that leaked video where she smoked salvia Mary Barista blow Escobar 8:13 This way, Backstreet Seattle sober Grown up emo kid Panic at the Costco Hair starting to fallout boy Sugar it hurts when I'm leaning My chemical reverse mortgage Draw from bucket Spermologist Love goth girls Spooky bitches? Love some Edgar Allen Hoes Fired from hot topic scaring customers Tattoo on her thigh of Jack skelington signing a child support check Nightmare before the Christmas that her parents got divorced This is Halloween who gets custody Every other Halloween Astrojizzicist All intensive purposes."
J2141,"A person's own name is the most beautiful sound they can hear in any language. What's your name (Crowd work) My stage name is Kris Raves But my real name is -FuckFace D. McCuckCock (dirty) The D stands for Diarrheadick -Dingleturd Von Stinkenstein (cleaning) -The N word (racial) -Adolf Stalintrump (political) Hard on the ears but it Sounds like Mozart to me. I heard if you match your breathing with other people you can feel what they feel. Wanna try it? Everybody breathe in, breathe out. Breathe in, did you feel that? Breathe out, (*audience members name* just farted, Breathe in... Ugh nnnn... Breathe out cough.",1,1,60,George Carlin,R / club material,long/story bit,work/money | body/medical,personal,,"A person's own name is the most beautiful sound they can hear in any language. What's your name (Crowd work) My stage name is Kris Raves But my real name is -FuckFace D. McCuckCock (dirty) The D stands for Diarrheadick -Dingleturd Von Stinkenstein (cleaning) -The N word (racial) -Adolf Stalintrump (political) Hard on the ears but it Sounds like Mozart to me. I heard if you match your breathing with other people you can feel what they feel. Wanna try it? Everybody breathe in, breathe out. Breathe in, did you feel that? Breathe out, (*audience members name* just farted, Breathe in... Ugh nnnn... Breathe out cough."
J2142,"Ever drive home so high you get to your house THEN enter your address in your GPS? If you spread all the money in the world out equally it would eventually end up in the same 5 pockets. Some people are better at Capitol allocation than others. Those people should manage our resources to make life better for everyone, not just themselves. And if they don't? We murder them. Assassinating tyrants and seizing the means of production doesn't sound like fun to you? There's a lot of people who don't like me I don't know anyone who doesn't like you They must not like you either.",1,1,60,Anthony Jeselnik,R / club material,long/story bit,true crime/dark | work/money,dark | personal,,"Ever drive home so high you get to your house THEN enter your address in your GPS? If you spread all the money in the world out equally it would eventually end up in the same 5 pockets. Some people are better at Capitol allocation than others. Those people should manage our resources to make life better for everyone, not just themselves. And if they don't? We murder them. Assassinating tyrants and seizing the means of production doesn't sound like fun to you? There's a lot of people who don't like me I don't know anyone who doesn't like you They must not like you either."
J2143,"I try to NOT look at everybody's butts. But I definitely still do. It's hard not to. Staring is creepy, and it's usually not sexual. Usually. By the way usually not sexual is the name of my next album coming out next summer or whenever I stop feeling relevant. But a booty only needs one glance to take a mental photograph to make an assessment. Ass...essment. Is that a pun about buns? A bun pun? Ba dump hack. A buddy told me if you were breast fed you grow up loving tits. Where are my butt lovin' bros? God only knows what we ate as babies.",1,1,60,Nikki Glaser,R / club material,long/story bit,dating/sex | religion/spiritual | body/medical,relationship | absurd | personal,,"I try to NOT look at everybody's butts. But I definitely still do. It's hard not to. Staring is creepy, and it's usually not sexual. Usually. By the way usually not sexual is the name of my next album coming out next summer or whenever I stop feeling relevant. But a booty only needs one glance to take a mental photograph to make an assessment. Ass...essment. Is that a pun about buns? A bun pun? Ba dump hack. A buddy told me if you were breast fed you grow up loving tits. Where are my butt lovin' bros? God only knows what we ate as babies."
J2144,Cafe coco 11/4/22 Yung gravy OG mayo ASAP hot sauce That one's pretty good actually Guages Spermologist Don't make noise when you laugh Tiger King Unicorn Sanctuary Joe psychedelic Serial killer Bisexual buffalo bill John Wayne probably gaycy Bed wetting serial killers Six men who looked like my uncle Emo kid My chemical midlife crisis? Jimmy eat world then Jimmy eats tums because Jimmy has acid reflux. Panic at the Costco Strip club grocery store Pluto astrojizzicist 810 closer Stop trying to figure it out and start enjoying it. #comedyset.,1,1,60,Nikki Glaser,R / club material,long/story bit,dating/sex | family | true crime/dark,dark | relationship | personal,,Cafe coco 11/4/22 Yung gravy OG mayo ASAP hot sauce That one's pretty good actually Guages Spermologist Don't make noise when you laugh Tiger King Unicorn Sanctuary Joe psychedelic Serial killer Bisexual buffalo bill John Wayne probably gaycy Bed wetting serial killers Six men who looked like my uncle Emo kid My chemical midlife crisis? Jimmy eat world then Jimmy eats tums because Jimmy has acid reflux. Panic at the Costco Strip club grocery store Pluto astrojizzicist 810 closer Stop trying to figure it out and start enjoying it. #comedyset.
J2145,"Middle class trailer trash Grew up just outside the sticks. We called it the boonies. Had more money than some people but not enough to be respected. One of my best friends as a kid was dirt poor. His mom decorated his entire double wide trailer out of the Marlboro rewards catalog. Pretty sure she bought their pickup truck with points. She only had half a lung left but she looked cool as hell in that leather bomber jacket. My poor friend never stood a chance. Dad named him Harley, you know, from the Bible. Remember David from the Bible? David's son is named Harley. Harley Davidson.",1,1,60,Norm Macdonald,PG-13,long/story bit,family | religion/spiritual | work/money | technology,personal,,"Middle class trailer trash Grew up just outside the sticks. We called it the boonies. Had more money than some people but not enough to be respected. One of my best friends as a kid was dirt poor. His mom decorated his entire double wide trailer out of the Marlboro rewards catalog. Pretty sure she bought their pickup truck with points. She only had half a lung left but she looked cool as hell in that leather bomber jacket. My poor friend never stood a chance. Dad named him Harley, you know, from the Bible. Remember David from the Bible? David's son is named Harley. Harley Davidson."
